{
  "name": "My Protection Market List",
  "timestamp": "2021-09-01T00:00:00+00:00",
  "markets": [
    {
      "chainId": 1,
      "address": "0xdBDF2fC3Af896e18f2A9DC58883d12484202b57E",
      "symbol": "cozyUSDC",
      "name": "Cozy USD Coin",
      "decimals": 256,
      "logoURI": "https://raw.githubusercontent.com/compound-finance/token-list/master/assets/asset_USDC.svg",
      "tags": ["stablecoin", "money market"],
      "trigger": "0x0000000000000000000000000000000000000000",
      "isTriggered": false,
      "underlying": {
        "chainId": 1,
        "address": "0xA0b86991c6218b36c1d19D4a2e9Eb0cE3606eB48",
        "symbol": "USDC",
        "name": "USD Coin",
        "decimals": 6,
        "logoURI": "https://raw.githubusercontent.com/compound-finance/token-list/master/assets/asset_USDC.svg",
        "tags": ["stablecoin"]
      }
    },
    {
      "chainId": 1,
      "address": "0x9affB6D8568cEfa2837d251b1553967430D1a5e5",
      "symbol": "Cozy-USDC-2",
      "name": "Cozy-USDC-2-Yearn USDC V2 Vault Share Price Trigger",
      "decimals": 8,
      "logoURI": "https://compound.finance/compound-components/assets/asset_YFI.svg",
      "tags": ["stablecoin", "protection market"],
      "trigger": "0x02E57c5800a345Fe97d73fA8bB72B948E19aA499",
      "isTriggered": false,
      "underlying": {
        "chainId": 1,
        "address": "0xA0b86991c6218b36c1d19D4a2e9Eb0cE3606eB48",
        "symbol": "USDC",
        "name": "USD Coin",
        "decimals": 6,
        "logoURI": "https://raw.githubusercontent.com/compound-finance/token-list/master/assets/asset_USDC.svg",
        "tags": ["stablecoin"]
      }
    }
  ],
  "version": {
    "major": 1,
    "minor": 0,
    "patch": 0
  }
}
