{
  "name": "My Token List",
  "timestamp": "2020-06-12T00:00:00+00:00",
  "markets": [
    {
      "chainId": 1,
      "address": "0xdBDF2fC3Af896e18f2A9DC58883d12484202b57E",
      "symbol": "cozyUSDC",
      "name": "Cozy USD Coin",
      "decimals": 8,
      "trigger": "0x0000000000000000000000000000000000000000",
      "isTriggered": false,
      "underlying": {
        "chainId": 1,
        "address": "0xA0b86991c6218b36c1d19D4a2e9Eb0cE3606eB48",
        "symbol": "USDC",
        "name": "USD Coin",
        "decimals": 6
      }
    }
  ],
  "version": {
    "major": 1,
    "minor": 0,
    "patch": 0
  }
}
